Reading OpenROAD database at '/Users/prahalad/ReversableGate/openlane/conventional-carry-select-openlane/runs/RUN_2025-11-05_20-14-14/38-openroad-globalrouting/carry_select_wrapper.odb'…
Reading library file at '/Users/prahalad/.volare/volare/sky130/versions/0fe599b2afb6708d281543108caf8310912f54af/sky130A/libs.ref/sky130_fd_sc_hd/lib/sky130_fd_sc_hd__tt_025C_1v80.lib'…
Reading design constraints file at '/nix/store/4an8h2zgjvxb79xycic0fl63w2yk470s-python3-3.11.9-env/lib/python3.11/site-packages/openlane/scripts/base.sdc'…
[INFO] Using clock clk…
[INFO] Setting output delay to: 5
[INFO] Setting input delay to: 5
[INFO] Setting load to: 0.033442
[INFO] Setting clock uncertainty to: 0.25
[INFO] Setting clock transition to: 0.1499999999999999944488848768742172978818416595458984375
[INFO] Setting timing derate to: 5%
[INFO] Setting signal min routing layer to: met1 and clock min routing layer to met1. 
[INFO] Setting signal max routing layer to: met5 and clock max routing layer to met5. 
-congestion_iterations 50 -verbose
[INFO GRT-0020] Min routing layer: met1
[INFO GRT-0021] Max routing layer: met5
[INFO GRT-0022] Global adjustment: 30%
[INFO GRT-0023] Grid origin: (0, 0)
[INFO GRT-0043] No OR_DEFAULT vias defined.
[INFO GRT-0088] Layer li1     Track-Pitch = 0.4600  line-2-Via Pitch: 0.3400
[INFO GRT-0088] Layer met1    Track-Pitch = 0.3400  line-2-Via Pitch: 0.3400
[INFO GRT-0088] Layer met2    Track-Pitch = 0.4600  line-2-Via Pitch: 0.3500
[INFO GRT-0088] Layer met3    Track-Pitch = 0.6800  line-2-Via Pitch: 0.6150
[INFO GRT-0088] Layer met4    Track-Pitch = 0.9200  line-2-Via Pitch: 1.0400
[INFO GRT-0088] Layer met5    Track-Pitch = 3.4000  line-2-Via Pitch: 3.1100
[INFO GRT-0019] Found 4 clock nets.
[INFO GRT-0001] Minimum degree: 2
[INFO GRT-0002] Maximum degree: 14
[INFO GRT-0003] Macros: 0
[INFO GRT-0043] No OR_DEFAULT vias defined.
[INFO GRT-0004] Blockages: 369

[INFO GRT-0053] Routing resources analysis:
          Routing      Original      Derated      Resource
Layer     Direction    Resources     Resources    Reduction (%)
---------------------------------------------------------------
li1        Vertical            0             0          0.00%
met1       Horizontal       1624           765          52.89%
met2       Vertical         1350           792          41.33%
met3       Horizontal        812           504          37.93%
met4       Vertical          562           312          44.48%
met5       Horizontal        156            70          55.13%
---------------------------------------------------------------

[INFO GRT-0197] Via related to pin nodes: 626
[INFO GRT-0198] Via related Steiner nodes: 5
[INFO GRT-0199] Via filling finished.
[INFO GRT-0111] Final number of vias: 767
[INFO GRT-0112] Final usage 3D: 2560

[INFO GRT-0096] Final congestion report:
Layer         Resource        Demand        Usage (%)    Max H / Max V / Total Overflow
---------------------------------------------------------------------------------------
li1                  0             0            0.00%             0 /  0 /  0
met1               765           110           14.38%             0 /  0 /  0
met2               792           142           17.93%             0 /  0 /  0
met3               504             7            1.39%             0 /  0 /  0
met4               312             0            0.00%             0 /  0 /  0
met5                70             0            0.00%             0 /  0 /  0
---------------------------------------------------------------------------------------
Total             2443           259           10.60%             0 /  0 /  0

[INFO GRT-0018] Total wirelength: 3346 um
[INFO GRT-0014] Routed nets: 160
[INFO GRT-0006] Repairing antennas, iteration 1.
[INFO GRT-0043] No OR_DEFAULT vias defined.
[INFO GRT-0012] Found 0 antenna violations.
Placement Analysis
---------------------------------
total displacement          0.0 u
average displacement        0.0 u
max displacement            0.0 u
original HPWL            1605.8 u
legalized HPWL           1672.9 u
delta HPWL                    4 %

[INFO DPL-0020] Mirrored 61 instances
[INFO DPL-0021] HPWL before            1672.9 u
[INFO DPL-0022] HPWL after             1605.8 u
[INFO DPL-0023] HPWL delta               -4.0 %
-congestion_iterations 50 -verbose
[INFO GRT-0020] Min routing layer: met1
[INFO GRT-0021] Max routing layer: met5
[INFO GRT-0022] Global adjustment: 30%
[INFO GRT-0023] Grid origin: (0, 0)
[INFO GRT-0043] No OR_DEFAULT vias defined.
[INFO GRT-0088] Layer li1     Track-Pitch = 0.4600  line-2-Via Pitch: 0.3400
[INFO GRT-0088] Layer met1    Track-Pitch = 0.3400  line-2-Via Pitch: 0.3400
[INFO GRT-0088] Layer met2    Track-Pitch = 0.4600  line-2-Via Pitch: 0.3500
[INFO GRT-0088] Layer met3    Track-Pitch = 0.6800  line-2-Via Pitch: 0.6150
[INFO GRT-0088] Layer met4    Track-Pitch = 0.9200  line-2-Via Pitch: 1.0400
[INFO GRT-0088] Layer met5    Track-Pitch = 3.4000  line-2-Via Pitch: 3.1100
[INFO GRT-0019] Found 4 clock nets.
[INFO GRT-0001] Minimum degree: 2
[INFO GRT-0002] Maximum degree: 14
[INFO GRT-0003] Macros: 0
[INFO GRT-0043] No OR_DEFAULT vias defined.
[INFO GRT-0004] Blockages: 369

[INFO GRT-0053] Routing resources analysis:
          Routing      Original      Derated      Resource
Layer     Direction    Resources     Resources    Reduction (%)
---------------------------------------------------------------
li1        Vertical            0             0          0.00%
met1       Horizontal       1624           765          52.89%
met2       Vertical         1350           792          41.33%
met3       Horizontal        812           504          37.93%
met4       Vertical          562           312          44.48%
met5       Horizontal        156            70          55.13%
---------------------------------------------------------------

[INFO GRT-0197] Via related to pin nodes: 626
[INFO GRT-0198] Via related Steiner nodes: 5
[INFO GRT-0199] Via filling finished.
[INFO GRT-0111] Final number of vias: 767
[INFO GRT-0112] Final usage 3D: 2560

[INFO GRT-0096] Final congestion report:
Layer         Resource        Demand        Usage (%)    Max H / Max V / Total Overflow
---------------------------------------------------------------------------------------
li1                  0             0            0.00%             0 /  0 /  0
met1               765           110           14.38%             0 /  0 /  0
met2               792           142           17.93%             0 /  0 /  0
met3               504             7            1.39%             0 /  0 /  0
met4               312             0            0.00%             0 /  0 /  0
met5                70             0            0.00%             0 /  0 /  0
---------------------------------------------------------------------------------------
Total             2443           259           10.60%             0 /  0 /  0

[INFO GRT-0018] Total wirelength: 3346 um
[INFO GRT-0014] Routed nets: 160
[INFO] Setting RC values…
Setting global connections for newly added cells…
[INFO] Setting global connections...
Updating metrics…
Cell type report:                       Count       Area
  Fill cell                                36     135.13
  Tap cell                                 30      37.54
  Clock buffer                              3      75.07
  Timing Repair Buffer                     35     185.18
  Inverter                                 28     105.10
  Sequential cell                          26     650.62
  Multi-Input combinational cell           49     329.07
  Total                                   207    1517.71
Writing OpenROAD database to '/Users/prahalad/ReversableGate/openlane/conventional-carry-select-openlane/runs/RUN_2025-11-05_20-14-14/41-openroad-repairantennas/1-diodeinsertion/carry_select_wrapper.odb'…
Writing layout to '/Users/prahalad/ReversableGate/openlane/conventional-carry-select-openlane/runs/RUN_2025-11-05_20-14-14/41-openroad-repairantennas/1-diodeinsertion/carry_select_wrapper.def'…
